{
  "id": "mlos-automation-architecture",
  "title": "Inside MLOS: How We Automated the Entire Release, Test, and Publish Pipeline",
  "date": "2026-01-05",
  "author": {
    "name": "MLOS Core Team",
    "github": "mlOS-foundation",
    "role": "Core Development Team"
  },
  "category": "architecture",
  "featured": true,
  "badge": "ARCHITECTURE",
  "summary": "A comprehensive look at how MLOS automates its release pipeline across private and public repositories, including kernel module builds, E2E testing, and website publishing—all triggered by a single release event.",
  "reading_time": "15 min read",
  "content": "# Inside MLOS: The Fully Automated Release Pipeline\n\n## The Challenge\n\nMLOS is a complex system spanning multiple repositories with different visibility requirements:\n\n- **Private repos** contain proprietary source code and kernel patches\n- **Public repos** distribute binaries, documentation, and test reports\n- **Kernel modules** must match Core versions exactly\n- **E2E tests** validate every release across 32+ ML models\n- **Website** must stay in sync with latest releases\n\nManaging all this manually would be error-prone and time-consuming. Instead, we built a fully automated pipeline where **a single release event triggers everything**.\n\n---\n\n## Architecture Overview\n\n```\n┌─────────────────────────────────────────────────────────────────────────────┐\n│                        MLOS AUTOMATION ARCHITECTURE                         │\n├─────────────────────────────────────────────────────────────────────────────┤\n│                                                                             │\n│   PRIVATE REPOS                         PUBLIC REPOS                        │\n│   ────────────                          ────────────                        │\n│                                                                             │\n│   ┌─────────────┐                      ┌──────────────────┐                │\n│   │    core     │─────────────────────▶│  core-releases   │                │\n│   │  (source)   │   sync-to-public     │   (binaries)     │                │\n│   └──────┬──────┘                      └────────┬─────────┘                │\n│          │                                      │                          │\n│          │ on: release                          │                          │\n│          ▼                                      ▼                          │\n│   ┌─────────────┐                      ┌──────────────────┐                │\n│   │    axon     │                      │ mlos-linux-kernel│                │\n│   │ (ML layer)  │                      │ (kernel modules) │                │\n│   └──────┬──────┘                      └────────┬─────────┘                │\n│          │                                      │                          │\n│          │ downloads                            │ downloads                │\n│          ▼                                      ▼                          │\n│   ┌─────────────┐                      ┌──────────────────┐                │\n│   │ system-test │─────────────────────▶│  GitHub Pages    │                │\n│   │  (E2E)      │   render-report      │  (test reports)  │                │\n│   └─────────────┘                      └──────────────────┘                │\n│                                                                             │\n│                         ┌──────────────────┐                               │\n│                         │ mlosfoundation   │                               │\n│                         │     .org         │                               │\n│                         │   (website)      │                               │\n│                         └──────────────────┘                               │\n│                                  ▲                                         │\n│                                  │                                         │\n│                    news-sync, blog-sync, release-sync                      │\n│                                                                             │\n└─────────────────────────────────────────────────────────────────────────────┘\n```\n\n---\n\n## The Release Flow\n\nWhen a developer creates a release in the private `core` repo, a cascade of automated workflows begins:\n\n```\n┌────────────────────────────────────────────────────────────────────────────┐\n│                           RELEASE FLOW SEQUENCE                            │\n├────────────────────────────────────────────────────────────────────────────┤\n│                                                                            │\n│  1. PUBLISH ARTIFACTS                                                      │\n│     ─────────────────                                                      │\n│     ┌──────────┐                                                           │\n│     │ Developer│                                                           │\n│     │ creates  │                                                           │\n│     │ release  │                                                           │\n│     └────┬─────┘                                                           │\n│          │                                                                 │\n│          ▼                                                                 │\n│     ┌─────────────────────────────────────────────────────────────┐       │\n│     │                  publish-artifacts.yml                       │       │\n│     │  ┌─────────────────────────────────────────────────────┐    │       │\n│     │  │ Build Matrix (4 platforms in parallel):             │    │       │\n│     │  │  • linux-amd64  (gcc)                               │    │       │\n│     │  │  • linux-arm64  (aarch64-linux-gnu-gcc)             │    │       │\n│     │  │  • darwin-amd64 (clang -arch x86_64)                │    │       │\n│     │  │  • darwin-arm64 (clang -arch arm64)                 │    │       │\n│     │  └─────────────────────────────────────────────────────┘    │       │\n│     │                          │                                   │       │\n│     │                          ▼                                   │       │\n│     │  ┌─────────────────────────────────────────────────────┐    │       │\n│     │  │ Dependencies bundled:                               │    │       │\n│     │  │  • ONNX Runtime 1.18.0                              │    │       │\n│     │  │  • llama.cpp (GGUF support)                         │    │       │\n│     │  │  • libtorch (PyTorch runtime)                       │    │       │\n│     │  └─────────────────────────────────────────────────────┘    │       │\n│     │                          │                                   │       │\n│     │                          ▼                                   │       │\n│     │  ┌─────────────────────────────────────────────────────┐    │       │\n│     │  │ Outputs:                                            │    │       │\n│     │  │  • mlos-core_{version}_{platform}.tar.gz            │    │       │\n│     │  │  • mlos-core_{version}_amd64.deb                    │    │       │\n│     │  │  • SHA256 checksums                                 │    │       │\n│     │  │  • GPG signatures (optional)                        │    │       │\n│     │  └─────────────────────────────────────────────────────┘    │       │\n│     └─────────────────────────────────────────────────────────────┘       │\n│                                                                            │\n│  2. SYNC TO PUBLIC                                                         │\n│     ───────────────                                                        │\n│          │                                                                 │\n│          │ on: release [published]                                         │\n│          ▼                                                                 │\n│     ┌─────────────────────────────────────────────────────────────┐       │\n│     │                   sync-to-public.yml                         │       │\n│     │                                                              │       │\n│     │  • Download artifacts from private release                   │       │\n│     │  • Filter: Only binaries (.tar.gz, .deb, .sha256)           │       │\n│     │  • Exclude: Source code archives                             │       │\n│     │  • Create matching release in core-releases                  │       │\n│     │  • Upload artifacts to public release                        │       │\n│     │  • Trigger kernel module build                               │       │\n│     └─────────────────────────────────────────────────────────────┘       │\n│                                                                            │\n│  3. KERNEL MODULE BUILD                                                    │\n│     ───────────────────                                                    │\n│          │                                                                 │\n│          │ triggered by sync-to-public                                     │\n│          ▼                                                                 │\n│     ┌─────────────────────────────────────────────────────────────┐       │\n│     │                sync-kernel-patches.yml                       │       │\n│     │                                                              │       │\n│     │  Build kernel modules for supported kernels:                 │       │\n│     │  ┌─────────────────────────────────────────────────────┐    │       │\n│     │  │  • mlos-ml-v{version}-linux-5.15.ko                 │    │       │\n│     │  │  • mlos-ml-v{version}-linux-6.1.ko                  │    │       │\n│     │  │  • mlos-ml-v{version}-linux-6.5.ko                  │    │       │\n│     │  │  • mlos-ml-v{version}-linux-6.8.ko